{
  "id": "urn:duly:fact:sha256:5d7360ca628321d8c5279ac7cc4501b408f6bbf27f57d5c29414c2669f1723ab",
  "contentHash": "5d7360ca628321d8c5279ac7cc4501b408f6bbf27f57d5c29414c2669f1723ab",
  "caseId": "case:golden:notice-fl-0060",
  "entity": {
    "id": "notice:notice-fl-0060",
    "type": "nc:TerminationNotice"
  },
  "attribute": "nc:noticeType",
  "value": {
    "kind": "code",
    "value": "Nonrenewal",
    "codeSystem": "duly-starter-notice/notice-types",
    "codeSystemVersion": "0.1.0"
  },
  "grounding": {
    "kind": "attestation",
    "actor": "golden-generator",
    "channel": "synthetic",
    "at": "2025-09-12T12:00:00Z"
  },
  "assertion": {
    "kind": "machine",
    "at": "2025-09-12T12:00:00Z",
    "extractor": {
      "name": "duly-golden-generator",
      "version": "0.1.0"
    }
  },
  "confidence": {
    "score": 1.0,
    "method": "raw"
  },
  "recordedAt": "2025-09-12T12:00:00Z",
  "status": "asserted",
  "schemaRef": {
    "ontology": "duly-starter-notice",
    "version": "0.1.0"
  }
}
