{
  "id": "urn:duly:fact:sha256:6740630d3fe060999d1c324c518689a882b5f38ca8ef5ea67d32e2f58b3de987",
  "contentHash": "6740630d3fe060999d1c324c518689a882b5f38ca8ef5ea67d32e2f58b3de987",
  "caseId": "case:golden:notice-fl-0015",
  "entity": {
    "id": "policy:notice-fl-0015",
    "type": "nc:Policy"
  },
  "attribute": "nc:governingState",
  "value": {
    "kind": "code",
    "value": "US-FL",
    "codeSystem": "iso-3166-2",
    "codeSystemVersion": "2020"
  },
  "grounding": {
    "kind": "attestation",
    "actor": "golden-generator",
    "channel": "synthetic",
    "at": "2026-01-24T12:00:00Z"
  },
  "assertion": {
    "kind": "machine",
    "at": "2026-01-24T12:00:00Z",
    "extractor": {
      "name": "duly-golden-generator",
      "version": "0.1.0"
    }
  },
  "confidence": {
    "score": 1.0,
    "method": "raw"
  },
  "recordedAt": "2026-01-24T12:00:00Z",
  "status": "asserted",
  "schemaRef": {
    "ontology": "duly-starter-notice",
    "version": "0.1.0"
  }
}
