{
  "id": "urn:duly:fact:sha256:8a980c58796c9835f3e88573e2ccd55be08bcabfea11f0f738294ff5d0082775",
  "contentHash": "8a980c58796c9835f3e88573e2ccd55be08bcabfea11f0f738294ff5d0082775",
  "caseId": "case:golden:ron-0014",
  "entity": {
    "id": "notarization:ron-0014",
    "type": "ron:Notarization"
  },
  "attribute": "ron:governingState",
  "value": {
    "kind": "code",
    "value": "US-CA",
    "codeSystem": "iso-3166-2",
    "codeSystemVersion": "2020"
  },
  "grounding": {
    "kind": "attestation",
    "actor": "golden-generator",
    "channel": "synthetic",
    "at": "2030-01-01T12:00:00Z"
  },
  "assertion": {
    "kind": "machine",
    "at": "2030-01-01T12:00:00Z",
    "extractor": {
      "name": "duly-golden-generator",
      "version": "0.1.0"
    }
  },
  "confidence": {
    "score": 1.0,
    "method": "raw"
  },
  "recordedAt": "2030-01-01T12:00:00Z",
  "status": "asserted",
  "schemaRef": {
    "ontology": "duly-mortgage-closing",
    "version": "0.1.0"
  }
}
