{
  "id": "urn:duly:fact:sha256:7869d6764c9862f88cf848a3da4dcaa8d031ea355d862cd802a4019bb6ce5a53",
  "contentHash": "7869d6764c9862f88cf848a3da4dcaa8d031ea355d862cd802a4019bb6ce5a53",
  "caseId": "case:golden:trid-0021",
  "entity": {
    "id": "fee:transfer-tax:trid-0021",
    "type": "trid:Fee"
  },
  "attribute": "trid:feeType",
  "value": {
    "kind": "code",
    "value": "TransferTax",
    "codeSystem": "duly-starter-trid/fee-types",
    "codeSystemVersion": "0.1.0"
  },
  "grounding": {
    "kind": "attestation",
    "actor": "golden-generator",
    "channel": "synthetic",
    "at": "2026-03-15T12:00:00Z"
  },
  "assertion": {
    "kind": "machine",
    "at": "2026-03-15T12:00:00Z",
    "extractor": {
      "name": "duly-golden-generator",
      "version": "0.1.0"
    }
  },
  "confidence": {
    "score": 1.0,
    "method": "raw"
  },
  "recordedAt": "2026-03-15T12:00:00Z",
  "status": "asserted",
  "schemaRef": {
    "ontology": "duly-starter-trid",
    "version": "0.1.0"
  }
}
