{
  "id": "urn:duly:fact:sha256:ef29b7d959696a23dfab3000a068a1381d94191112d0822fbd3a9ce5e8834ee3",
  "contentHash": "ef29b7d959696a23dfab3000a068a1381d94191112d0822fbd3a9ce5e8834ee3",
  "caseId": "case:golden:rec-0019",
  "entity": {
    "id": "submission:rec-0019",
    "type": "rec:RecordingSubmission"
  },
  "attribute": "rec:firstPageTopSpaceInches",
  "value": {
    "kind": "decimal",
    "value": "2.0"
  },
  "grounding": {
    "kind": "attestation",
    "actor": "golden-generator",
    "channel": "synthetic",
    "at": "2026-10-04T12:00:00Z"
  },
  "assertion": {
    "kind": "machine",
    "at": "2026-10-04T12:00:00Z",
    "extractor": {
      "name": "duly-golden-generator",
      "version": "0.1.0"
    }
  },
  "confidence": {
    "score": 0.95,
    "method": "conformal"
  },
  "recordedAt": "2026-10-04T12:00:00Z",
  "status": "asserted",
  "schemaRef": {
    "ontology": "duly-mortgage-closing",
    "version": "0.1.0"
  }
}
