{
  "id": "urn:duly:fact:sha256:afe961bd726bf1c94e8dd0da16f9a6135c365fe7c0015eaa5bb9d689c7a372aa",
  "contentHash": "afe961bd726bf1c94e8dd0da16f9a6135c365fe7c0015eaa5bb9d689c7a372aa",
  "caseId": "case:golden:notice-ny-0062",
  "entity": {
    "id": "policy:notice-ny-0062",
    "type": "nc:Policy"
  },
  "attribute": "nc:policyExpirationDate",
  "value": {
    "kind": "date",
    "value": "2026-01-06"
  },
  "grounding": {
    "kind": "attestation",
    "actor": "golden-generator",
    "channel": "synthetic",
    "at": "2025-11-25T12:00:00Z"
  },
  "assertion": {
    "kind": "machine",
    "at": "2025-11-25T12:00:00Z",
    "extractor": {
      "name": "duly-golden-generator",
      "version": "0.1.0"
    }
  },
  "confidence": {
    "score": 1.0,
    "method": "raw"
  },
  "recordedAt": "2025-11-25T12:00:00Z",
  "status": "asserted",
  "schemaRef": {
    "ontology": "duly-starter-notice",
    "version": "0.1.0"
  }
}
