{
  "id": "urn:duly:fact:sha256:d6c66688a80509a703e804e95a34d05c35bd6990e5875a82fa324f7132152f2a",
  "contentHash": "d6c66688a80509a703e804e95a34d05c35bd6990e5875a82fa324f7132152f2a",
  "caseId": "case:golden:notice-fl-0069",
  "entity": {
    "id": "notice:notice-fl-0069",
    "type": "nc:TerminationNotice"
  },
  "attribute": "nc:noticeMailedDate",
  "value": {
    "kind": "date",
    "value": "2026-02-05"
  },
  "grounding": {
    "kind": "attestation",
    "actor": "golden-generator",
    "channel": "synthetic",
    "at": "2026-02-05T12:00:00Z"
  },
  "assertion": {
    "kind": "machine",
    "at": "2026-02-05T12:00:00Z",
    "extractor": {
      "name": "duly-golden-generator",
      "version": "0.1.0"
    }
  },
  "confidence": {
    "score": 1.0,
    "method": "raw"
  },
  "recordedAt": "2026-02-05T12:00:00Z",
  "status": "asserted",
  "schemaRef": {
    "ontology": "duly-starter-notice",
    "version": "0.1.0"
  }
}
