{
  "id": "urn:duly:fact:sha256:a0009735f6ebfba2a2820172da957e75c0d6645b4f644e80ab4922365c034798",
  "contentHash": "a0009735f6ebfba2a2820172da957e75c0d6645b4f644e80ab4922365c034798",
  "caseId": "case:golden:notice-ca-0062",
  "entity": {
    "id": "notice:notice-ca-0062",
    "type": "nc:TerminationNotice"
  },
  "attribute": "nc:noticeMailedDate",
  "value": {
    "kind": "date",
    "value": "2026-07-07"
  },
  "grounding": {
    "kind": "attestation",
    "actor": "golden-generator",
    "channel": "synthetic",
    "at": "2026-07-07T12:00:00Z"
  },
  "assertion": {
    "kind": "machine",
    "at": "2026-07-07T12:00:00Z",
    "extractor": {
      "name": "duly-golden-generator",
      "version": "0.1.0"
    }
  },
  "confidence": {
    "score": 1.0,
    "method": "raw"
  },
  "recordedAt": "2026-07-07T12:00:00Z",
  "status": "asserted",
  "schemaRef": {
    "ontology": "duly-starter-notice",
    "version": "0.1.0"
  }
}
