{
  "id": "urn:duly:fact:sha256:3f4dbcc9024274ed4afb593cb6829b1d2f14de56e31739030d7bad77e6387254",
  "contentHash": "3f4dbcc9024274ed4afb593cb6829b1d2f14de56e31739030d7bad77e6387254",
  "caseId": "case:golden:ron-0016",
  "entity": {
    "id": "notarization:ron-0016",
    "type": "ron:Notarization"
  },
  "attribute": "ron:notarizationMethod",
  "value": {
    "kind": "code",
    "value": "InPerson",
    "codeSystem": "duly-starter-ron/notarization-methods",
    "codeSystemVersion": "0.1.0"
  },
  "grounding": {
    "kind": "attestation",
    "actor": "golden-generator",
    "channel": "synthetic",
    "at": "2028-12-31T12:00:00Z"
  },
  "assertion": {
    "kind": "machine",
    "at": "2028-12-31T12:00:00Z",
    "extractor": {
      "name": "duly-golden-generator",
      "version": "0.1.0"
    }
  },
  "confidence": {
    "score": 1.0,
    "method": "raw"
  },
  "recordedAt": "2028-12-31T12:00:00Z",
  "status": "asserted",
  "schemaRef": {
    "ontology": "duly-starter-ron",
    "version": "0.1.0"
  }
}
