{
  "id": "urn:duly:fact:sha256:19850c3622c3ea665d6f5c0460c6818690976785eae56dc4d7d4147128723bf5",
  "contentHash": "19850c3622c3ea665d6f5c0460c6818690976785eae56dc4d7d4147128723bf5",
  "caseId": "case:golden:notice-ca-0010",
  "entity": {
    "id": "notice:notice-ca-0010",
    "type": "nc:TerminationNotice"
  },
  "attribute": "nc:noticeType",
  "value": {
    "kind": "code",
    "value": "Nonrenewal",
    "codeSystem": "duly-starter-notice/notice-types",
    "codeSystemVersion": "0.1.0"
  },
  "grounding": {
    "kind": "attestation",
    "actor": "golden-generator",
    "channel": "synthetic",
    "at": "2025-09-16T12:00:00Z"
  },
  "assertion": {
    "kind": "machine",
    "at": "2025-09-16T12:00:00Z",
    "extractor": {
      "name": "duly-golden-generator",
      "version": "0.1.0"
    }
  },
  "confidence": {
    "score": 1.0,
    "method": "raw"
  },
  "recordedAt": "2025-09-16T12:00:00Z",
  "status": "asserted",
  "schemaRef": {
    "ontology": "duly-starter-notice",
    "version": "0.1.0"
  }
}
