{
  "id": "urn:duly:fact:sha256:f339e8e1239ebbab6ee7659d32e406568213d3039bd387cc814c0fafff015fc0",
  "contentHash": "f339e8e1239ebbab6ee7659d32e406568213d3039bd387cc814c0fafff015fc0",
  "caseId": "case:golden:esign-0001",
  "entity": {
    "id": "task:esign-0001",
    "type": "pkg:SigningTask"
  },
  "attribute": "pkg:documentType",
  "value": {
    "kind": "code",
    "value": "ClosingDisclosure",
    "codeSystem": "duly-starter-esign/document-types",
    "codeSystemVersion": "0.1.0"
  },
  "grounding": {
    "kind": "attestation",
    "actor": "golden-generator",
    "channel": "synthetic",
    "at": "2015-03-17T12:00:00Z"
  },
  "assertion": {
    "kind": "machine",
    "at": "2015-03-17T12:00:00Z",
    "extractor": {
      "name": "duly-golden-generator",
      "version": "0.1.0"
    }
  },
  "confidence": {
    "score": 1.0,
    "method": "raw"
  },
  "recordedAt": "2015-03-17T12:00:00Z",
  "status": "asserted",
  "schemaRef": {
    "ontology": "duly-mortgage-closing",
    "version": "0.1.0"
  }
}
