{
  "id": "urn:duly:fact:sha256:5f8b379ae07db3d2622d7dcda22136dda2106b3b80a1458714e5fed0da074346",
  "contentHash": "5f8b379ae07db3d2622d7dcda22136dda2106b3b80a1458714e5fed0da074346",
  "caseId": "case:golden:rec-0017",
  "entity": {
    "id": "submission:rec-0017",
    "type": "rec:RecordingSubmission"
  },
  "attribute": "rec:concurrentWithTaxedTransfer",
  "value": {
    "kind": "boolean",
    "value": true
  },
  "grounding": {
    "kind": "attestation",
    "actor": "golden-generator",
    "channel": "synthetic",
    "at": "2026-10-04T12:00:00Z"
  },
  "assertion": {
    "kind": "machine",
    "at": "2026-10-04T12:00:00Z",
    "extractor": {
      "name": "duly-golden-generator",
      "version": "0.1.0"
    }
  },
  "confidence": {
    "score": 1.0,
    "method": "raw"
  },
  "recordedAt": "2026-10-04T12:00:00Z",
  "status": "asserted",
  "schemaRef": {
    "ontology": "duly-starter-recording",
    "version": "0.1.0"
  }
}
