{
  "id": "urn:duly:fact:sha256:8fc9ff4a4c7928e6832f8d3bb795ce902d852e60bbfae0c17d90cfc7259b2ecf",
  "contentHash": "8fc9ff4a4c7928e6832f8d3bb795ce902d852e60bbfae0c17d90cfc7259b2ecf",
  "caseId": "case:golden:notice-ca-0042",
  "entity": {
    "id": "policy:notice-ca-0042",
    "type": "nc:Policy"
  },
  "attribute": "nc:governingState",
  "value": {
    "kind": "code",
    "value": "US-CA",
    "codeSystem": "iso-3166-2",
    "codeSystemVersion": "2020"
  },
  "grounding": {
    "kind": "attestation",
    "actor": "golden-generator",
    "channel": "synthetic",
    "at": "2026-07-05T12:00:00Z"
  },
  "assertion": {
    "kind": "machine",
    "at": "2026-07-05T12:00:00Z",
    "extractor": {
      "name": "duly-golden-generator",
      "version": "0.1.0"
    }
  },
  "confidence": {
    "score": 1.0,
    "method": "raw"
  },
  "recordedAt": "2026-07-05T12:00:00Z",
  "status": "asserted",
  "schemaRef": {
    "ontology": "duly-starter-notice",
    "version": "0.1.0"
  }
}
