{
  "id": "urn:duly:fact:sha256:62f0e91f1efc50322b3ee30e10b50f0b0a6f31d1df9ad6911fc519a84ce9cff7",
  "contentHash": "62f0e91f1efc50322b3ee30e10b50f0b0a6f31d1df9ad6911fc519a84ce9cff7",
  "caseId": "case:closing:ESC-4821-CA",
  "entity": {
    "id": "notarization:ESC-4821-CA:2026-03-12",
    "type": "ron:Notarization"
  },
  "attribute": "ron:governingState",
  "value": {
    "kind": "code",
    "value": "US-CA",
    "codeSystem": "iso-3166-2",
    "codeSystemVersion": "2020"
  },
  "grounding": {
    "kind": "document",
    "documentId": "doc:notary-certificate:ESC-4821-CA:2026-03-12",
    "documentSha256": "cbbf4eb1ce0d57b97b12eb7548b3c68d07562a6ad497639e39c05dba98386c07",
    "rendition": {
      "id": "rend:demo-extractor:0.1.0:cbbf4eb1",
      "extractor": "duly-demo-extractor",
      "extractorVersion": "0.1.0"
    },
    "page": 1,
    "charSpan": {
      "start": 95,
      "end": 114
    },
    "quote": "State of California"
  },
  "assertion": {
    "kind": "machine",
    "at": "2026-07-29T15:12:03Z",
    "extractor": {
      "name": "duly-demo-extractor",
      "version": "0.1.0",
      "runId": "run:2026-07-29:012"
    }
  },
  "confidence": {
    "score": 0.997,
    "method": "conformal",
    "calibrationRef": "cal:ron-docs:2026-06"
  },
  "recordedAt": "2026-07-29T15:12:03Z",
  "status": "asserted",
  "schemaRef": {
    "ontology": "duly-starter-ron",
    "version": "0.1.0"
  }
}
