{
  "id": "urn:duly:fact:sha256:ef33f4fb7deb4a794ccaab54cecc6e0236052baf620d14a07e750fefc08d880a",
  "contentHash": "ef33f4fb7deb4a794ccaab54cecc6e0236052baf620d14a07e750fefc08d880a",
  "caseId": "case:golden:notice-ca-0026",
  "entity": {
    "id": "policy:notice-ca-0026",
    "type": "nc:Policy"
  },
  "attribute": "nc:policyExpirationDate",
  "value": {
    "kind": "date",
    "value": "2025-09-13"
  },
  "grounding": {
    "kind": "attestation",
    "actor": "golden-generator",
    "channel": "synthetic",
    "at": "2025-06-10T12:00:00Z"
  },
  "assertion": {
    "kind": "machine",
    "at": "2025-06-10T12:00:00Z",
    "extractor": {
      "name": "duly-golden-generator",
      "version": "0.1.0"
    }
  },
  "confidence": {
    "score": 1.0,
    "method": "raw"
  },
  "recordedAt": "2025-06-10T12:00:00Z",
  "status": "asserted",
  "schemaRef": {
    "ontology": "duly-starter-notice",
    "version": "0.1.0"
  }
}
