{
  "id": "urn:duly:fact:sha256:0335abd80e4f99a57fadf66cd495c7f44a322dcbcd98a278bd41cf893bcbacfa",
  "contentHash": "0335abd80e4f99a57fadf66cd495c7f44a322dcbcd98a278bd41cf893bcbacfa",
  "caseId": "case:golden:notice-ny-0031",
  "entity": {
    "id": "notice:notice-ny-0031",
    "type": "nc:TerminationNotice"
  },
  "attribute": "nc:noticeType",
  "value": {
    "kind": "code",
    "value": "Nonrenewal",
    "codeSystem": "duly-starter-notice/notice-types",
    "codeSystemVersion": "0.1.0"
  },
  "grounding": {
    "kind": "attestation",
    "actor": "golden-generator",
    "channel": "synthetic",
    "at": "2026-10-03T12:00:00Z"
  },
  "assertion": {
    "kind": "machine",
    "at": "2026-10-03T12:00:00Z",
    "extractor": {
      "name": "duly-golden-generator",
      "version": "0.1.0"
    }
  },
  "confidence": {
    "score": 1.0,
    "method": "raw"
  },
  "recordedAt": "2026-10-03T12:00:00Z",
  "status": "asserted",
  "schemaRef": {
    "ontology": "duly-starter-notice",
    "version": "0.1.0"
  }
}
