{
  "id": "urn:duly:fact:sha256:7c26e64bea9417112fd01ba877f4e38d6a4c15fd39ef53a37bb33e7125242c4a",
  "contentHash": "7c26e64bea9417112fd01ba877f4e38d6a4c15fd39ef53a37bb33e7125242c4a",
  "caseId": "case:golden:notice-ny-0017",
  "entity": {
    "id": "policy:notice-ny-0017",
    "type": "nc:Policy"
  },
  "attribute": "nc:governingState",
  "value": {
    "kind": "code",
    "value": "US-NY",
    "codeSystem": "iso-3166-2",
    "codeSystemVersion": "2020"
  },
  "grounding": {
    "kind": "attestation",
    "actor": "golden-generator",
    "channel": "synthetic",
    "at": "2026-01-25T12:00:00Z"
  },
  "assertion": {
    "kind": "machine",
    "at": "2026-01-25T12:00:00Z",
    "extractor": {
      "name": "duly-golden-generator",
      "version": "0.1.0"
    }
  },
  "confidence": {
    "score": 1.0,
    "method": "raw"
  },
  "recordedAt": "2026-01-25T12:00:00Z",
  "status": "asserted",
  "schemaRef": {
    "ontology": "duly-starter-notice",
    "version": "0.1.0"
  }
}
