{
  "id": "urn:duly:fact:sha256:aae8788e36140f1a5daceb77c660c1d7615fbd99f51ab9707d1bb6db4c664696",
  "contentHash": "aae8788e36140f1a5daceb77c660c1d7615fbd99f51ab9707d1bb6db4c664696",
  "caseId": "case:golden:resc-0014",
  "entity": {
    "id": "loan:resc-0014",
    "type": "resc:Loan"
  },
  "attribute": "resc:statedRescissionDeadline",
  "value": {
    "kind": "date",
    "value": "2026-05-07"
  },
  "grounding": {
    "kind": "attestation",
    "actor": "golden-generator",
    "channel": "synthetic",
    "at": "2026-05-04T12:00:00Z"
  },
  "assertion": {
    "kind": "machine",
    "at": "2026-05-04T12:00:00Z",
    "extractor": {
      "name": "duly-golden-generator",
      "version": "0.1.0"
    }
  },
  "confidence": {
    "score": 1.0,
    "method": "raw"
  },
  "recordedAt": "2026-05-04T12:00:00Z",
  "status": "asserted",
  "schemaRef": {
    "ontology": "duly-mortgage-closing",
    "version": "0.1.0"
  }
}
