{
  "id": "urn:duly:fact:sha256:73b88759f0b44ae6f06202d1165237ba205e5fa197f8a7aaa38a425ab5e1354a",
  "contentHash": "73b88759f0b44ae6f06202d1165237ba205e5fa197f8a7aaa38a425ab5e1354a",
  "caseId": "case:golden:notice-ny-0038",
  "entity": {
    "id": "notice:notice-ny-0038",
    "type": "nc:TerminationNotice"
  },
  "attribute": "nc:noticeMailedDate",
  "value": {
    "kind": "date",
    "value": "2026-09-16"
  },
  "grounding": {
    "kind": "attestation",
    "actor": "golden-generator",
    "channel": "synthetic",
    "at": "2026-09-16T12:00:00Z"
  },
  "assertion": {
    "kind": "machine",
    "at": "2026-09-16T12:00:00Z",
    "extractor": {
      "name": "duly-golden-generator",
      "version": "0.1.0"
    }
  },
  "confidence": {
    "score": 1.0,
    "method": "raw"
  },
  "recordedAt": "2026-09-16T12:00:00Z",
  "status": "asserted",
  "schemaRef": {
    "ontology": "duly-starter-notice",
    "version": "0.1.0"
  }
}
